title,link,username,snippet,potential_text
Studio BY São Caetano (@studiobyscs),https://www.instagram.com/studiobyscs/,studiobyscs,3.3K+ followers · 579 posts · Seu momento de brilhar começa aqui! ✨ •Unhas de gel •Extensão de cílios Agende seu horário aqui:,"Potencial cliente pode procurar serviços de design visual para melhorar e harmonizar seu perfil social Instagram, incluindo site, landing pages ou automação."
Nail designer em São Caetano do Sul (@espacojumeneses),https://www.instagram.com/espacojumeneses/,espacojumeneses,"Transformo unhas & dias comuns em momentos únicos Nail Designer + Instrutora Conteúdo de beleza, rotina e autoestima Vem se cuidar comigo!",Potential customer could benefit from professional website and digital marketing services for brand visibility and customer engagement in nail design business.
Meus Cílios São Caetano (@meusciliossaocaetano),https://www.instagram.com/meusciliossaocaetano/reels/,,"Seu espaço de beleza ⏱ Seg à sex 8h às 21h aos Sábados 9h às 18h Cílios, Design e Micro ✨Av Goiás, 1750, São Caetano Agende aqui ...","Este perfil parece indicar um negócio de beleza localizado em São Caetano, oferecendo serviços de cílios, design e micro-pigmentação. O potencial para contratar serviços digitais, como site ou landing page, pode ser alto, dado que o proprietário já possui uma presença online forte com um perfil no Instagram. A automação também poderia ser útil para melhorar a organização do negócio e agendamento de clientes."
"Jake jakinha (@jakejakinha_nails) · São Caetano do Sul, SP",https://www.instagram.com/jakejakinha_nails/,jakejakinha_nails,""" Aqui quem brilha é Você! "" Nail Designer Proprietária: @jake_jakinha0 Av. Senador Roberto Simonsen,850 / Sala 3/Santo Antônio São Caetano ...","O cliente possui um perfil de profissional na área da beleza, que pode ser interessante para contratar serviços relacionados ao desenvolvimento de sites, páginas de aterrissagem ou automação para melhoria do negócio."
HM UNHAS 💖 (@hmunhas),https://www.instagram.com/hmunhas/,hmunhas,"Enviamos para todo Brasil Alameda São Caetano, 1769. São Caetano do Sul, SP. (11) 94016-6664 . . #unhasdodia #naildesigner #abcpaulista ...","Client may benefit from services such as website or landing page for local visibility and online bookings, given they offer nail design services in São Caetano do Sul, SP, Brazil."
Eduardo Caetano (@educaetano),https://www.instagram.com/educaetano/,educaetano,"1918 Followers, 4020 Following, 785 Posts - Eduardo Caetano (@educaetano) on Instagram: ""ARQUITETO DE JOGOS TOKEN | abstract game design""","Arquiteto de jogos possui uma base de seguidores interessados em design abstracto, potencial para projeto de site ou landing page."
Bruna Mello • SOBRANCELHA & CÍLIOS l São Caetano do ...,https://www.instagram.com/abrunabeauty/,abrunabeauty,"⚡️ Valorizo a sua forma de olhar e ser vista pelo mundo. + de 15.000 atendimentos transformadores! Lashes, Nails, Brows & Courses. ⤵️ ᴡʜᴀᴛsᴀᴘᴘ ʟɪɴᴋ: ...",Potencial alto em mercado de beleza e treinamento com amplo seguimento e história de atendimentos transformadores.
Designer de unhas (@marydesigner.sa) - Mariana Sá,https://www.instagram.com/marydesigner.sa/,marydesigner.sa,"✨️Especialista em alongamento de unhas ✨️ ✨️Diva não gasta, investe! ✨️ R. Eng. Rebouças, 297 - B. Cerâmica SCS Informações e agendamentos ⬇️ · ""Cada conquista é ...",Potential for frequent bookings and marketing opportunities in beauty services sector.
Unhas São Caetano do Sul (@annarachel.unhas),https://www.instagram.com/annarachel.unhas/,annarachel.unhas,Unha em Gel e Alongamento efeito natural e elegante. Transformo suas unhas em arte para elevar sua autoestima. Clique abaixo e venha realçar sua beleza!,"Potential client for beauty-related digital services, focusing on aesthetically appealing visual content and customer self-confidence boost."
"Ainda na fazenda , E ainda fazendo , meus avós diziam",https://www.instagram.com/p/DOaX6JXAIhy/,jorgelbelias,"... São Caetano o padroeiro da casa e também são eduardo por meu filho e meu neto e São Bernardo , o meu também outro neto E continuamos a ...","O perfil indica uma ligação com uma fazenda e família tradicionalista, possivelmente em expansão, que poderia ter interesse em investimentos digitais como um site, landing page ou automação para melhorar a organização da sua atividade e interagir mais com o público."
Paulo Caetano (@paulocaetanodesigner),https://www.instagram.com/paulocaetanodesigner/,paulocaetanodesigner,"Designer.Animador.Ilustrador ... Quando falamos em ancestralidade, logo pensamos em múmias e seus sarcófagos, ou desenhos rupestres em cavernas pré-históricas!","""Paulo Caetano (@paulocaetanodesigner) may be an excellent fit for website, landing page or automation services due to his background as a Designer and Illustrator, focusing on ancient art and culture themes."""
